{
  "kind": "sail-project-result",
  "schema_version": 2,
  "run_id": "1-1792606960960530055",
  "workspace": "/evidence/attempt-3/cache/neutral-contracts-v1/9664379c4d04d6be287faf003390ab987cb08d804ead0afa77646ab9c46eeb53",
  "context_sha256": "01efcf1db3bda242c3d8a4f825b3229ba9214c191ed8072c5d3d2079b017d2e1",
  "input_revision": "1502c9e9bf9dbec3fa1ac2e1ded4895df11dbd6aaa87fb0eca1f5a65f35e464a",
  "currentness": "current",
  "exit_code": 0,
  "targets": [
    {
      "package_id": "path+file:///evidence/attempt-3/cache/neutral-contracts-v1/9664379c4d04d6be287faf003390ab987cb08d804ead0afa77646ab9c46eeb53#neutral@0.0.0",
      "target": "neutral",
      "kind": [
        "lib"
      ],
      "establishing_run": "1-1792606960960530055",
      "reused": false,
      "requested": true,
      "complete": true,
      "report": {
        "schema_version": 2,
        "sail_version": "0.1.0",
        "mode": "default",
        "command": [],
        "exit_code": 0,
        "solver": {
          "name": "z3",
          "version": "4.16.0",
          "path": "/opt/verus/verus-x86-linux/z3",
          "sha256": "e583c4186a45e72411fa2cb2048401eed03f0f8e5f24694676a8f6271a50b765"
        },
        "cache": {
          "daemon": false
        },
        "attribution": {
          "status": "complete",
          "notes": [],
          "unmatched_sessions": 0
        },
        "crates": [
          {
            "name": "neutral",
            "verus": {
              "verified": 1,
              "errors": 0,
              "success": true,
              "encountered_vir_error": false
            },
            "functions": [
              {
                "function": "neutral::candidate",
                "module": "",
                "fn_mode": "exec",
                "verdict": "verified",
                "establishment": "confirmed",
                "evidence_tier": "smt_verified",
                "unstable": false,
                "verus_success": true,
                "provenance": {
                  "mode": "default",
                  "source": "fresh",
                  "checks_solved": 1,
                  "checks_served": 0,
                  "checks_unrecorded": 0
                },
                "timing": {
                  "smt_micros": 1670,
                  "rlimit": 2227
                },
                "fragility": null,
                "obligations": [
                  {
                    "id": "neutral::candidate#Function-Def/0",
                    "kind": "Function-Def",
                    "ordinal": 0,
                    "spinoff": null,
                    "advisory": false,
                    "span": {
                      "text": "src/lib.rs:4:428: 4:473 (#0)",
                      "file": "src/lib.rs",
                      "line": 4,
                      "column": 428,
                      "end_line": 4,
                      "end_column": 473
                    },
                    "outcome": "proved",
                    "unstable": false,
                    "checks": [
                      {
                        "answer": "unsat",
                        "rlimit_limit": 30000000,
                        "rlimit_used": 2227,
                        "reason_unknown": null,
                        "source": "solved"
                      }
                    ],
                    "counterexample": null
                  }
                ]
              }
            ]
          }
        ],
        "diagnostics": [],
        "summary": {
          "functions": 1,
          "verified": 1,
          "failed": 0,
          "unknown": 0,
          "provisional": 0,
          "unstable": 0
        },
        "error": null
      }
    }
  ],
  "execution": {
    "verifier_invocations": 2,
    "reused_targets": 0,
    "wall_ms": 36291.668992
  },
  "notes": [
    "Build-script input declarations were established during this run"
  ],
  "error": null
}
